{
  "id": "shipping-fee",
  "version": "v1",
  "title": "快递费管理",
  "project": "快递费管理",
  "type": "flow",
  "mode": "spec",
  "designSystem": "elsa-enterprise",
  "author": "产品团队",
  "createdAt": "2026-07-04",
  "changeSummary": "新增附加费与其他费用配置：费用类型联动显隐、SurchargeTableEditor 组件、visibleWhen 机制",
  "status": "draft"
}
