{
  "id": "price-card-management",
  "version": "v1",
  "title": "价卡管理",
  "project": "价卡管理",
  "type": "flow",
  "mode": "spec",
  "designSystem": "elsa-enterprise",
  "author": "产品团队",
  "createdAt": "2026-07-05",
  "changeSummary": "详情页改为与编辑页同布局的只读独立页，form/detail 费用配置拆分为 shared.sections 片段",
  "status": "draft"
}